{
  "schema_version": "1.0.0",
  "registry_id": "ct-advisor-task-templates",
  "registry_version": "1.0.0",
  "published_at": "2026-10-23T00:00:00.000Z",
  "maturity_levels": [
    { "id": "preview", "name_zh": "预览", "name_en": "Preview", "meaning_zh": "流程可体验，字段或覆盖范围仍可能变化。", "meaning_en": "The workflow is usable for evaluation, while fields or coverage may still change." },
    { "id": "beta", "name_zh": "测试", "name_en": "Beta", "meaning_zh": "主要流程可用，覆盖范围和支持边界仍受限。", "meaning_en": "The primary workflow is usable with bounded coverage and support." },
    { "id": "stable", "name_zh": "稳定", "name_en": "Stable", "meaning_zh": "模板合同和基础行为稳定，仍不代表结果保证。", "meaning_en": "The template contract and baseline behavior are stable without guaranteeing outcomes." }
  ],
  "templates": [
    { "template_id": "ai-inference-infrastructure-selection/v1", "template_key": "ai-inference-infrastructure-selection", "version": "1.0.0", "title_zh": "推理基础设施选型", "title_en": "Inference infrastructure selection", "summary_zh": "比较 GPU、云、地域和网络候选，形成可解释的采购前建议。", "summary_en": "Compare GPU, cloud, region, and network candidates for an explainable pre-procurement recommendation.", "maturity": "stable", "default_enabled": true, "enabled": true, "state_reason": "published", "access": "free", "package_eligible": true, "execution_mode": "decision_support_only", "capability_tags": ["gpu", "cloud", "region", "network", "inference"], "fixture_id": "fixture-ai-inference-infrastructure-selection-v1" },
    { "template_id": "ai-inference-capacity-sizing/v1", "template_key": "ai-inference-capacity-sizing", "version": "1.0.0", "title_zh": "推理容量 Sizing", "title_en": "Inference capacity sizing", "summary_zh": "按模型、流量和服务目标估算推理容量，不虚构缺失参数。", "summary_en": "Estimate inference capacity from model, traffic, and service targets without inventing missing inputs.", "maturity": "stable", "default_enabled": true, "enabled": true, "state_reason": "published", "access": "free", "package_eligible": false, "execution_mode": "decision_support_only", "capability_tags": ["gpu", "inference", "sizing"], "fixture_id": "fixture-ai-inference-capacity-sizing-v1" },
    { "template_id": "gpu-comparison/v1", "template_key": "gpu-comparison", "version": "1.0.0", "title_zh": "GPU 比较", "title_en": "GPU comparison", "summary_zh": "按公开或用户提供的性能、容量、成本与风险输入比较 GPU。", "summary_en": "Compare GPUs using public or user-supplied performance, capacity, cost, and risk inputs.", "maturity": "stable", "default_enabled": true, "enabled": true, "state_reason": "published", "access": "free", "package_eligible": false, "execution_mode": "decision_support_only", "capability_tags": ["gpu", "comparison"], "fixture_id": "fixture-gpu-comparison-v1" },
    { "template_id": "cloud-region-network-comparison/v1", "template_key": "cloud-region-network-comparison", "version": "1.0.0", "title_zh": "云、地域与网络比较", "title_en": "Cloud, region, and network comparison", "summary_zh": "比较跨云、地域和网络组合的成本、时延、可用性与约束。", "summary_en": "Compare cost, latency, availability, and constraints across cloud, region, and network combinations.", "maturity": "beta", "default_enabled": true, "enabled": true, "state_reason": "published", "access": "free", "package_eligible": false, "execution_mode": "decision_support_only", "capability_tags": ["cloud", "region", "network", "comparison"], "fixture_id": "fixture-cloud-region-network-comparison-v1" },
    { "template_id": "build-rent-cloud-comparison/v1", "template_key": "build-rent-cloud-comparison", "version": "1.0.0", "title_zh": "自建、租赁与云比较", "title_en": "Build, rent, and cloud comparison", "summary_zh": "比较自建、租赁和云服务路径的成本结构、交付周期与风险。", "summary_en": "Compare cost structure, delivery lead time, and risk across build, rent, and cloud paths.", "maturity": "beta", "default_enabled": true, "enabled": true, "state_reason": "published", "access": "free", "package_eligible": false, "execution_mode": "decision_support_only", "capability_tags": ["build", "rent", "cloud", "tco"], "fixture_id": "fixture-build-rent-cloud-comparison-v1" },
    { "template_id": "training-infrastructure-selection/v1", "template_key": "training-infrastructure-selection", "version": "1.0.0", "title_zh": "训练基础设施选型", "title_en": "Training infrastructure selection", "summary_zh": "预览训练规模、互连、存储和交付约束的候选比较流程。", "summary_en": "Preview candidate comparison across training scale, interconnect, storage, and delivery constraints.", "maturity": "preview", "default_enabled": true, "enabled": true, "state_reason": "published", "access": "free", "package_eligible": false, "execution_mode": "decision_support_only", "capability_tags": ["gpu", "training", "interconnect", "storage"], "fixture_id": "fixture-training-infrastructure-selection-v1" },
    { "template_id": "infrastructure-migration-assessment/v1", "template_key": "infrastructure-migration-assessment", "version": "1.0.0", "title_zh": "基础设施迁移评估", "title_en": "Infrastructure migration assessment", "summary_zh": "预览现状、目标候选、迁移依赖和退出风险的结构化评估。", "summary_en": "Preview a structured assessment of current state, targets, migration dependencies, and exit risks.", "maturity": "preview", "default_enabled": true, "enabled": true, "state_reason": "published", "access": "free", "package_eligible": false, "execution_mode": "decision_support_only", "capability_tags": ["migration", "risk", "exit"], "fixture_id": "fixture-infrastructure-migration-assessment-v1" },
    { "template_id": "data-residency-screening/v1", "template_key": "data-residency-screening", "version": "1.0.0", "title_zh": "数据驻留筛选", "title_en": "Data residency screening", "summary_zh": "预览地域、数据类别和声明式驻留约束的候选排除流程。", "summary_en": "Preview candidate exclusion using region, data-class, and declared residency constraints.", "maturity": "preview", "default_enabled": true, "enabled": true, "state_reason": "published", "access": "free", "package_eligible": false, "execution_mode": "decision_support_only", "capability_tags": ["region", "data_residency", "screening"], "fixture_id": "fixture-data-residency-screening-v1" }
  ]
}
